<?xml version="1.0" encoding="UTF-8"?>
<tns:crown-flow xmlns:tns="http://www.techlords.com/crown-flow"
	xmlns:xsi="http://www.w3.org/2001/XMLSchema-instance"
	xsi:schemaLocation="http://www.techlords.com/crown-flow crown-flow.xsd ">
	<tns:flow-id>InvoiceFlow</tns:flow-id>
	<tns:flow-class>InvoiceBO</tns:flow-class>
	<tns:flow-steps>
		<tns:step>
			<tns:step-id>1</tns:step-id>
			<tns:step-name>GENERATED</tns:step-name>
			<tns:step-description>Invoice Created</tns:step-description>
			<tns:first-step>true</tns:first-step>
			<tns:next-step-id>2</tns:next-step-id>
		</tns:step>
		<tns:step>
			<tns:step-id>2</tns:step-id>
			<tns:step-name>PRINTED</tns:step-name>
			<tns:step-description>Original Invoice Printed.</tns:step-description>
			<tns:next-step-id>3</tns:next-step-id>
			<tns:next-step-id>4</tns:next-step-id>
			<tns:next-step-id>5</tns:next-step-id>
			<tns:next-step-id>6</tns:next-step-id>
		</tns:step>
		<tns:step>
			<tns:step-id>3</tns:step-id>
			<tns:step-name>DELIVERED</tns:step-name>
			<tns:step-description>Order Delivered</tns:step-description>
			<tns:next-step-id>8</tns:next-step-id>
		</tns:step>
		<tns:step>
			<tns:step-id>4</tns:step-id>
			<tns:step-name>RETURNED</tns:step-name>
			<tns:step-description>Items Returned</tns:step-description>
			<tns:next-step-id>7</tns:next-step-id>
		</tns:step>
		<tns:step>
			<tns:step-id>5</tns:step-id>
			<tns:step-name>CANCELLED</tns:step-name>
			<tns:step-description>Order cancelled/Items shall be completely returned.</tns:step-description>
			<tns:next-step-id>7</tns:next-step-id>
		</tns:step>
		<tns:step>
			<tns:step-id>6</tns:step-id>
			<tns:step-name>PARTIAL_DELIVERY</tns:step-name>
			<tns:step-description>Order Partially Delivered</tns:step-description>
			<tns:next-step-id>7</tns:next-step-id>
		</tns:step>
		<tns:step>
			<tns:step-id>7</tns:step-id>
			<tns:step-name>CREDIT_NOTE</tns:step-name>
			<tns:step-description>Credit Note released</tns:step-description>
			<tns:next-step-id>8</tns:next-step-id>
		</tns:step>
		<tns:step>
			<tns:step-id>8</tns:step-id>
			<tns:step-name>CLOSED</tns:step-name>
			<tns:step-description>Invoice Closed. No further process</tns:step-description>
		</tns:step>
	</tns:flow-steps>
</tns:crown-flow>
